{
  "$schema": "https://vireocode.com/schemas/entity/v1.json",
  "schemaVersion": 1,
  "kind": "entity",
  "entity": { "name": "Customer", "plural": "customers" },
  "database": { "table": "customer", "migrationVersion": 3 },
  "api": { "path": "/api/customers" },
  "permissions": { "read": "hasRole('USER')", "manage": "hasRole('SUPERADMIN')" },
  "capabilities": { "history": false, "offline": false, "query": true },
  "fields": [{ "name": "legalName", "type": "string", "required": true, "query": { "searchable": true } }],
  "localization": { "en": { "singular": "Customer", "plural": "Customers" } }
}
